{
  "$schema": "https://json-schema.org/draft-07/schema#",
  "title": "Schema",
  "description": "Un esquema para una base de datos de preguntas, respuestas y ejemplos en inglés.",
  "type": "object",
  "properties": {
    "$schema": {
      "type": "string",
      "default": "./schema.json"
    },
    "title": {
      "type": "string",
      "title": "Title",
      "description": "Descriptive title for the question set."
    },
    "slug": {
      "type": "string",
      "title": "Slug",
      "description": "Unique identifier for the question set."
    },
    "language": {
      "type": "string",
      "title": "Lenguaje",
      "description": "Lenguaje en el que están escritas las preguntas, respuestas y ejemplos. Por defecto: 'en' (inglés).",
      "default": "en"
    },
    "questions": {
      "type": "array",
      "title": "Preguntas",
      "description": "Lista de preguntas con sus respuestas y ejemplos.",
      "items": {
        "type": "object",
        "title": "Pregunta",
        "description": "Una pregunta con su respuesta y ejemplo.",
        "properties": {
          "question": {
            "type": "string",
            "title": "Pregunta"
          },
          "answer": {
            "type": "string",
            "title": "Respuesta"
          },
          "meaning": {
            "type": "string",
            "title": "Meaning",
            "description": "Explanation or meaning of the question or answer."
          },
          "example": {
            "type": "string",
            "title": "Ejemplo"
          },
          "choices": {
            "type": "array",
            "title": "Opciones",
            "description": "Opciones de respuesta para la pregunta.",
            "items": {
              "type": "string"
            }
          }
        },
        "required": ["question", "answer"]
      }
    }
  },
  "required": ["questions"]
}
