{
  "$schema": "./schema.json",
  "language": "en",
  "questions": [
    {
      "question": "I ____ (finish) my homework by 8 PM.",
      "answer": "will have finished",
      "choices": ["will finish", "will have finished", "finish", "finishing"],
      "example": "I will have finished my homework by 8 PM."
    },
    {
      "question": "She ____ (graduate) from university by next year.",
      "answer": "will have graduated",
      "choices": [
        "will graduate",
        "will have graduated",
        "graduates",
        "graduating"
      ],
      "example": "She will have graduated from university by next year."
    },
    {
      "question": "They ____ (build) the house by December.",
      "answer": "will have built",
      "choices": ["will build", "will have built", "build", "building"],
      "example": "They will have built the house by December."
    },
    {
      "question": "We ____ (travel) to five countries by the end of the year.",
      "answer": "will have traveled",
      "choices": ["will travel", "will have traveled", "travel", "traveling"],
      "example": "We will have traveled to five countries by the end of the year."
    },
    {
      "question": "He ____ (complete) the project before the deadline.",
      "answer": "will have completed",
      "choices": [
        "will complete",
        "will have completed",
        "completes",
        "completing"
      ],
      "example": "He will have completed the project before the deadline."
    },
    {
      "question": "You ____ (learn) Spanish by the time you move to Spain.",
      "answer": "will have learned",
      "choices": ["will learn", "will have learned", "learn", "learning"],
      "example": "You will have learned Spanish by the time you move to Spain."
    }
  ],
  "slug": "future-perfect",
  "title": "Future Perfect"
}
